[
  {
    "id": "corporate-finance.z2.1",
    "local_id": "Z2.1",
    "module": "corporate-finance",
    "zone": 2,
    "ordinal": 1,
    "title": "PLACEHOLDER — Zone 2 front door",
    "tag": "core",
    "global_id": null,
    "quick_definition": "PLACEHOLDER: Replace with one-sentence definition.",
    "explainer_covers": [
      "PLACEHOLDER: Add explainer bullets (basic to technical)."
    ],
    "connects_to": [],
    "gaps": [],
    "status": "mapped"
  }
]
